{
  "optionListId" : "1" ,
  "checkedValue" : "undefined" ,
  "uncheckedValue" : "undefined" ,
  "displayType" : "undefined" ,
  "dataType" : "undefined" ,
  "defaultValue" : "undefined" ,
  "isReadOnly" : "true" ,
  "isRequired" : "false" ,
  "isStandard" : "undefined" ,
  "outputFormatId" : "undefined"
}